id,text,label,source,notes
215,"Most Canadians cant afford to go see the games with the current pricing structure. This World Cup more than any other one before it really has brought forth the worst in the current state of the world. The U.S. is a disaster. Other world cups have been hosted in questionable locations (Russia, Quatar)but this one seems worse than any other one. Visitors travel permits being cancelled, ICE, the absolute greed being put on display by FIFA, the FIFA world peace prize? you know right now if a local wants to go see a game in Toronto tickets start at $6k CND($4.3k USD). Thats just insane.",analysis,r/soccer,
216,"Look at Instagram and Twitter, and youll see how much fun people are having this past week during friendly matches",hot_take,r/soccer,
217,Honestly the travel is similar to Brazil with much better infrastructure and honestly less in most cases as the groups are mostly region,hot_take,r/soccer,
218,They shouldn't be hosting the WC across so many massive countries. The host really should have just been one of Mexico or USA.,hot_take,r/soccer,
219,"yup. it feels very off in the US. Infantino is a joke, and he should be fired for his trump arse kissing.",hot_take,r/soccer,
220,"I mean if fifa was willing to allow American stadiums to host the games as intended, this would still he a shitshow but less so. American football stadiums were built for car culture not public transport. Its why some of the bigger stadiums have parking for 30k plus cars. When you take that away you take away not only the primary mode of transport, but also the primary mode of pre gaming. If European fans or SA fans came for a tailgate, theyd understand, accept and even like it.",analysis,r/soccer,
221,when youre the greatest country in the world people will just hat lol.,reaction,r/soccer,
222,Dont forget ICE detaining and denying entry to some of the Iraq World Cup team and its associated staffing.,hot_take,r/soccer,
223,This world cup is trash. If you wanna see what a proper world cup looks like see South Africa 2010,hot_take,r/soccer,
